{
  "artifacts": {
    "calibration_fit": {
      "path": "../evals/frozen/calibration-fit-v2.jsonl",
      "role": "calibration_fit",
      "schema": "kev.artifact-ref.v1",
      "sha256": "d0e7d4fcffef2c3ccd376acb2c77a1fb90289224caa046cddc88c9656ace101c",
      "size_bytes": 14516
    },
    "encoder_acquisition_receipt": {
      "path": "../models/local/encoders/all-MiniLM-L6-v2/1110a243fdf4706b3f48f1d95db1a4f5529b4d41/acquisition-receipt.json",
      "role": "encoder_acquisition_receipt",
      "schema": "kev.artifact-ref.v1",
      "sha256": "a9bf2c04260c78d8bf6795560fb64123aea13cb32e7e036caee9168537e07f38",
      "size_bytes": 4703
    },
    "encoder_acquisition_script": {
      "path": "../scripts/acquire_frozen_encoder.py",
      "role": "encoder_acquisition_script",
      "schema": "kev.artifact-ref.v1",
      "sha256": "0c7ef798ddc210f84e8aebcff401ecfedce3cc6872adc00e1e0f5e2421f6f563",
      "size_bytes": 11760
    },
    "encoder_manifest": {
      "path": "../models/local/encoders/all-MiniLM-L6-v2/1110a243fdf4706b3f48f1d95db1a4f5529b4d41/encoder-manifest.json",
      "role": "encoder_manifest",
      "schema": "kev.artifact-ref.v1",
      "sha256": "cfd8f8bc3413f31ab927ad7d78eb380c3359fdb2893061075d2369dfec81ea57",
      "size_bytes": 3417
    },
    "encoder_source_record": {
      "path": "../models/encoder-sources/all-MiniLM-L6-v2-1110a243fdf4706b3f48f1d95db1a4f5529b4d41.json",
      "role": "encoder_source_record",
      "schema": "kev.artifact-ref.v1",
      "sha256": "a46078dd1c13d9114bff07a891a1a903c1281681cf6dd3002e8d9e5ea8da03e9",
      "size_bytes": 4765
    },
    "eval_baseline_v6": {
      "path": "../evals/evidence/v6-genesis-baseline.json",
      "role": "eval_baseline_v6",
      "schema": "kev.artifact-ref.v1",
      "sha256": "881e1f6911379f9bc158fde300147f1d41416b8076fbc1a972786c6ddc9915e4",
      "size_bytes": 750064
    },
    "eval_builder_v6": {
      "path": "../scripts/build_public_eval_pack_v6.py",
      "role": "eval_builder_v6",
      "schema": "kev.artifact-ref.v1",
      "sha256": "1092090456f26d2e78a272664d34031fb0550c595983db502117c0ba1b763a32",
      "size_bytes": 17264
    },
    "eval_freshness_audit_v5": {
      "path": "../evals/evidence/v5-fresh-template-audit.json",
      "role": "eval_freshness_audit_v5",
      "schema": "kev.artifact-ref.v1",
      "sha256": "b307dfafbe7d15c27a0b3d9d63a928aab05c1d99125877b8d0db74737b23ee65",
      "size_bytes": 6044
    },
    "executable_source__kev___init___py__1a4f1b1cdc2a": {
      "path": "../kev/__init__.py",
      "role": "executable_source__kev___init___py__1a4f1b1cdc2a",
      "schema": "kev.artifact-ref.v1",
      "sha256": "425e76d71e2d6bee495a67e8a03b5f94c67a9b9b24135be6c97753ebf8dbe969",
      "size_bytes": 240
    },
    "executable_source__kev_actions_py__01a5a7b509ee": {
      "path": "../kev/actions.py",
      "role": "executable_source__kev_actions_py__01a5a7b509ee",
      "schema": "kev.artifact-ref.v1",
      "sha256": "d7f4add51e3cb47d7432ef9c789526aafc1ee502eb3fcafc184516f6f70c8a50",
      "size_bytes": 29874
    },
    "executable_source__kev_artifacts_py__d23d26ab3f14": {
      "path": "../kev/artifacts.py",
      "role": "executable_source__kev_artifacts_py__d23d26ab3f14",
      "schema": "kev.artifact-ref.v1",
      "sha256": "47f025c46cee6761b09331268d3f94e84014d715d56b3dfa6d66fe4f44b21a67",
      "size_bytes": 4706
    },
    "executable_source__kev_calibration_evidence_py__bd66e390cd42": {
      "path": "../kev/calibration_evidence.py",
      "role": "executable_source__kev_calibration_evidence_py__bd66e390cd42",
      "schema": "kev.artifact-ref.v1",
      "sha256": "6c0c1c49ba0106c031d5b5e6a93593dd2763dfae4ce8e91b6a39d100b53d600e",
      "size_bytes": 24491
    },
    "executable_source__kev_calibration_py__bf1676ec1c18": {
      "path": "../kev/calibration.py",
      "role": "executable_source__kev_calibration_py__bf1676ec1c18",
      "schema": "kev.artifact-ref.v1",
      "sha256": "aab6dc15689fd170472b7545acc01817491cb616c4a74e8066369a49a9350a8f",
      "size_bytes": 9723
    },
    "executable_source__kev_cli_py__d07776ff958e": {
      "path": "../kev/cli.py",
      "role": "executable_source__kev_cli_py__d07776ff958e",
      "schema": "kev.artifact-ref.v1",
      "sha256": "26401f95b87f8218ecebe92a13aafe6019ee6c4e2a3c20661b53bcd5cfe879a5",
      "size_bytes": 18512
    },
    "executable_source__kev_encoders_py__5349fe37566b": {
      "path": "../kev/encoders.py",
      "role": "executable_source__kev_encoders_py__5349fe37566b",
      "schema": "kev.artifact-ref.v1",
      "sha256": "9cc0e367da1f02d6629bbe187ebda344ca137f2fbd02ffd9c3d48602467c54c9",
      "size_bytes": 26022
    },
    "executable_source__kev_evaluation_py__11611607c0d4": {
      "path": "../kev/evaluation.py",
      "role": "executable_source__kev_evaluation_py__11611607c0d4",
      "schema": "kev.artifact-ref.v1",
      "sha256": "d0670e5ca634883377690d2190008f062d6d3d06b20a15e39f9dd92baf0ed334",
      "size_bytes": 48887
    },
    "executable_source__kev_evolution_py__1e6c18f47ca7": {
      "path": "../kev/evolution.py",
      "role": "executable_source__kev_evolution_py__1e6c18f47ca7",
      "schema": "kev.artifact-ref.v1",
      "sha256": "cff082349035c9ff314db06481e25bd339a04957566b0cf09da7f54fc228084d",
      "size_bytes": 57409
    },
    "executable_source__kev_frames_py__0580bd3b1c64": {
      "path": "../kev/frames.py",
      "role": "executable_source__kev_frames_py__0580bd3b1c64",
      "schema": "kev.artifact-ref.v1",
      "sha256": "3e8f583611effaab4d435dd70edb3f91d48384af682061370e98cbf57152884d",
      "size_bytes": 50033
    },
    "executable_source__kev_model_runtime_py__58a4b4e699cf": {
      "path": "../kev/model_runtime.py",
      "role": "executable_source__kev_model_runtime_py__58a4b4e699cf",
      "schema": "kev.artifact-ref.v1",
      "sha256": "bacf4e2e922f8c780cd97c37b61756b9028ef10962205af4b0c3136b9ff9f6e9",
      "size_bytes": 8803
    },
    "executable_source__kev_sentence_training_py__ee3d3410b65a": {
      "path": "../kev/sentence_training.py",
      "role": "executable_source__kev_sentence_training_py__ee3d3410b65a",
      "schema": "kev.artifact-ref.v1",
      "sha256": "3632c342c2ef9f468ae341213e0958e37f506eb9f1995de3d27b86a2ec91cc59",
      "size_bytes": 21933
    },
    "executable_source__kev_uc51___init___py__34a1f3329676": {
      "path": "../kev/uc51/__init__.py",
      "role": "executable_source__kev_uc51___init___py__34a1f3329676",
      "schema": "kev.artifact-ref.v1",
      "sha256": "9a8682142d97fe218bc8d5bbc5843efa1c1ebdb931285170b1be1f1a87aabdd5",
      "size_bytes": 32
    },
    "executable_source__kev_uc51_cli_py__54a3c5e2434b": {
      "path": "../kev/uc51/cli.py",
      "role": "executable_source__kev_uc51_cli_py__54a3c5e2434b",
      "schema": "kev.artifact-ref.v1",
      "sha256": "f16963cf4c0e5d8127cd1b4a868b7ed4d1c66948eef44d947f959184c50097ec",
      "size_bytes": 2141
    },
    "executable_source__kev_uc51_semantic_core_py__5bd6bf4be294": {
      "path": "../kev/uc51/semantic_core.py",
      "role": "executable_source__kev_uc51_semantic_core_py__5bd6bf4be294",
      "schema": "kev.artifact-ref.v1",
      "sha256": "99f386526b6b8bafb6c20820d293e736a889fd45e27f0d5978c54dd47c1647cb",
      "size_bytes": 6036
    },
    "executable_source__kev_uc51a2___init___py__9a117418c104": {
      "path": "../kev/uc51a2/__init__.py",
      "role": "executable_source__kev_uc51a2___init___py__9a117418c104",
      "schema": "kev.artifact-ref.v1",
      "sha256": "5f128113c8dca4925312133f4b4a7386f6d4cf2a774ac26cd4bef7489ed3de7a",
      "size_bytes": 32
    },
    "executable_source__kev_uc51a2_cli_py__e5f32f4228da": {
      "path": "../kev/uc51a2/cli.py",
      "role": "executable_source__kev_uc51a2_cli_py__e5f32f4228da",
      "schema": "kev.artifact-ref.v1",
      "sha256": "7e3f3d3ecf9e4d2858bbe1aa089a28db79fc5fc0417f505f95612f2ec4f07171",
      "size_bytes": 2051
    },
    "executable_source__kev_uc51a2_semantic_breadth_py__60701180c319": {
      "path": "../kev/uc51a2/semantic_breadth.py",
      "role": "executable_source__kev_uc51a2_semantic_breadth_py__60701180c319",
      "schema": "kev.artifact-ref.v1",
      "sha256": "8f5fe48a7a697ee3c9f87b52e76aa9e71a6e8c2058894d004ac768a5a6a61f95",
      "size_bytes": 44581
    },
    "executable_source__kev_uc51a3___init___py__c839ce805420": {
      "path": "../kev/uc51a3/__init__.py",
      "role": "executable_source__kev_uc51a3___init___py__c839ce805420",
      "schema": "kev.artifact-ref.v1",
      "sha256": "60dbcb8facce6ebcdb754512e78d7b8201b2dc102a124aedc8937251f7aeae32",
      "size_bytes": 31
    },
    "executable_source__kev_uc51a3_alive_py__077958be4a61": {
      "path": "../kev/uc51a3/alive.py",
      "role": "executable_source__kev_uc51a3_alive_py__077958be4a61",
      "schema": "kev.artifact-ref.v1",
      "sha256": "fd2c96b2e51a1e628b2dbd95f2e5ea53bb437c9cec4a9486755dfd386d8f63df",
      "size_bytes": 50844
    },
    "executable_source__kev_uc51a3_cli_py__8b701942f4cc": {
      "path": "../kev/uc51a3/cli.py",
      "role": "executable_source__kev_uc51a3_cli_py__8b701942f4cc",
      "schema": "kev.artifact-ref.v1",
      "sha256": "bc407347fe619e7e9760b1d9a0294a7c8e6d9f123d0cdb173208d54bf1e85676",
      "size_bytes": 4202
    },
    "executable_source__kev_uc51a3_server_py__9c0fc7638d96": {
      "path": "../kev/uc51a3/server.py",
      "role": "executable_source__kev_uc51a3_server_py__9c0fc7638d96",
      "schema": "kev.artifact-ref.v1",
      "sha256": "a670b9c1c9e2a1f033ba0f99105731d3540226e2d145a0abbe648324fc105670",
      "size_bytes": 7469
    },
    "executable_source__scripts_run_preregistered_experiment_py__1e6ce77eeb86": {
      "path": "../scripts/run_preregistered_experiment.py",
      "role": "executable_source__scripts_run_preregistered_experiment_py__1e6ce77eeb86",
      "schema": "kev.artifact-ref.v1",
      "sha256": "bac9bef2848e23ac1238cba235f1546cf0f6f17c005547a1f2b5259d2d8aa65a",